<?xml version="1.0" encoding="UTF-8"?>

<!DOCTYPE granite-config PUBLIC "-//Granite Data Services//DTD granite-config internal//EN"
    "http://www.graniteds.org/public/dtd/2.0.0/granite-config.dtd">

<!--
  GRANITE DATA SERVICES
  Copyright (C) 2007-2010 ADEQUATE SYSTEMS SARL

  This file is part of Granite Data Services.

  Granite Data Services is free software; you can redistribute it and/or modify
  it under the terms of the GNU Library General Public License as published by
  the Free Software Foundation; either version 2 of the License, or (at your
  option) any later version.

  Granite Data Services is distributed in the hope that it will be useful, but
  WITHOUT ANY WARRANTY; without even the implied warranty of MERCHANTABILITY or
  FITNESS FOR A PARTICULAR PURPOSE. See the GNU Library General Public License
  for more details.

  You should have received a copy of the GNU Library General Public License
  along with this library; if not, see <http://www.gnu.org/licenses/>.
-->

<granite-config scan="true">

	<class-getter type="org.granite.tide.test.TestClassGetter"/>
    
   <!--
    ! Use Seam based security service.
    !-->
    <security type="org.granite.seam21.security.Seam21SecurityService"/>
    
    <!--
     ! Enable Seam components for Tide
     !-->
    <tide-components>
        <tide-component instance-of="org.jboss.seam.security.Identity"/>
        <tide-component instance-of="org.jboss.seam.framework.Home"/>
        <tide-component instance-of="org.jboss.seam.framework.Query"/>
        <tide-component type="org\.granite\.tide\.test\..*"/>
    </tide-components>

</granite-config>
